{
  "domain": "abdisbarber.com",
  "name": "Abdi's Barber",
  "pages": {
    "/": {
      "title": "Abdi's Barber",
      "content": "Barbershop in Amsterdam."
    }
  },
  "actions": [
    {
      "id": "book",
      "name": "Contact",
      "description": "Send a message",
      "intent": [
        "contact",
        "message",
        "email"
      ],
      "input": {
        "type": "object",
        "required": true,
        "fields": [
          {
            "name": "date",
            "type": "date",
            "required": true
          }
        ]
      },
      "endpoint": {
        "url": "https://abdisbarber.com/api/book"
      }
    }
  ],
  "lawp_version": "0.3"
}
